{
  "project": {
    "name": "olympus-cloud-knowledge",
    "description": "Olympus Cloud platform documentation and knowledge base"
  },
  "repositories": [
    {
      "name": "olympus-docs",
      "url": "https://github.com/OlympusCloud/olympus-docs.git",
      "branch": "main",
      "paths": ["/"],
      "exclude": ["node_modules", ".git", "dist", "build"],
      "priority": "high",
      "category": "documentation",
      "syncInterval": 3600,
      "authType": "none"
    },
    {
      "name": "kubernetes-docs",
      "url": "https://github.com/kubernetes/website.git",
      "branch": "main",
      "paths": ["/content/en/docs"],
      "exclude": ["node_modules", ".git", "static", "assets"],
      "priority": "medium",
      "category": "infrastructure",
      "syncInterval": 86400,
      "authType": "none",
      "metadata": {
        "type": "kubernetes",
        "relevance": "Olympus uses Kubernetes for orchestration"
      }
    },
    {
      "name": "helm-docs",
      "url": "https://github.com/helm/helm-www.git",
      "branch": "main",
      "paths": ["/content/en/docs"],
      "exclude": ["node_modules", ".git", "themes"],
      "priority": "medium",
      "category": "deployment",
      "syncInterval": 86400,
      "authType": "none",
      "metadata": {
        "type": "helm",
        "relevance": "Helm charts for Olympus deployments"
      }
    },
    {
      "name": "prometheus-docs",
      "url": "https://github.com/prometheus/docs.git",
      "branch": "main",
      "paths": ["/content/docs"],
      "exclude": ["node_modules", ".git"],
      "priority": "medium",
      "category": "monitoring",
      "syncInterval": 86400,
      "authType": "none",
      "metadata": {
        "type": "monitoring",
        "relevance": "Prometheus for Olympus monitoring"
      }
    },
    {
      "name": "terraform-docs",
      "url": "https://github.com/hashicorp/terraform-website.git",
      "branch": "main",
      "paths": ["/content/docs"],
      "exclude": ["node_modules", ".git", "public"],
      "priority": "medium",
      "category": "infrastructure",
      "syncInterval": 86400,
      "authType": "none",
      "metadata": {
        "type": "iac",
        "relevance": "Infrastructure as Code for Olympus"
      }
    }
  ],
  "contextGeneration": {
    "strategies": ["hybrid"],
    "maxChunks": 30,
    "priorityWeighting": {
      "high": 2.0,
      "medium": 1.0,
      "low": 0.5
    }
  },
  "vectorStore": {
    "type": "qdrant",
    "qdrant": {
      "url": "http://localhost:6333",
      "collectionName": "olympus_knowledge"
    }
  },
  "server": {
    "port": 3000,
    "host": "localhost",
    "cors": {
      "enabled": true,
      "origins": ["http://localhost:*"]
    }
  }
}